鄉鎮市區,交易標的,土地位置建物門牌,土地移轉總面積平方公尺,都市土地使用分區,非都市土地使用分區,非都市土地使用編定,交易年月日,交易筆棟數,移轉層次,總樓層數,建物型態,主要用途,主要建材,建築完成年月,建物移轉總面積平方公尺,建物現況格局-房,建物現況格局-廳,建物現況格局-衛,建物現況格局-隔間,有無管理組織,總價元,單價元平方公尺,車位類別,車位移轉總面積平方公尺,車位總價元,備註,編號,主建物面積,附屬建物面積,陽台面積,電梯,移轉編號
The villages and towns urban district,transaction sign,land sector position building sector house number plate,land shifting total area square meter,the use zoning or compiles and checks,the non-metropolis land use district,non-metropolis land use,transaction year month and day,transaction pen number,shifting level,total floor number,building state,main use,main building materials,construction to complete the years,building shifting total area,Building present situation pattern - room,building present situation pattern - hall,building present situation pattern - health,building present situation pattern - compartmented,Whether there is manages the organization,total price NTD,the unit price (NTD / square meter),the berth category,berth shifting total area square meter,the berth total price NTD,the note,serial number,main building area,auxiliary building area,balcony area,elevator,transaction number
文山區,土地,景美段二小段271地號,25.9,住,,,1140208,土地1建物0車位0,,,其他,,,,0.0,0,0,0,無,無,7000000,270270,,0.0,0,親友、員工、共有人或其他特殊關係間之交易；,RPWQMLRKKHKGFAA38DA,0.0,0.0,0.0,無,001
大同區,車位,臺北市大同區承德路二段３９號房屋地下一層,0.0,,,,1140217,土地0建物1車位1,地下一層,十一層,其他,見使用執照,鋼筋混凝土造,0810630,59.19,0,0,0,無,有,2000000,,升降平面,59.19,2000000,建物坐落地號：圓環段二小段466地號；僅車位交易；,RPSNMLKLKHKGFBA17DA,0.0,0.0,0.0,有,002
中山區,車位,臺北市中山區雙城街１３巷１１號三樓之１,0.18,商,,,1140203,土地1建物1車位1,三層,十五層,其他,住家用,鋼筋混凝土造,1010327,0.17,0,0,0,無,有,2200000,,坡道平面,0.0,2200000,僅車位交易；,RPPNMLRKKHKGFCA57DA,0.0,0.0,0.0,有,003
萬華區,車位,臺北市萬華區西寧南路３６號地下三樓,2.62,都市：其他:第四種商業區。,,,1140206,土地1建物1車位1,地下三層,十層,其他,防空避難室兼停車場,預力混凝土造,0671215,31.12,0,0,0,無,有,1750000,,坡道平面,31.12,1750000,僅車位交易；,RPTNMLTKKHKGFBA18EA,0.0,0.0,0.0,有,004
中山區,房地(土地+建物),臺北市中山區松江路７７巷１０號六樓,47.57,住,,,1140210,土地1建物1車位0,六層,六層,華廈(10層含以下有電梯),住家用,鋼筋混凝土造,0650913,256.44,3,2,2,有,無,66000000,257370,,0.0,0,,RPPNMLSKKHKGFCA77EA,193.1,24.7,38.64,有,
萬華區,房地(土地+建物),臺北市萬華區和平西路三段３８４號三樓之１８,3.83,住,,,1140207,土地2建物1車位0,三層,八層,華廈(10層含以下有電梯),住家用,鋼筋混凝土造,0700706,33.19,1,1,1,有,有,5450000,164206,,0.0,0,陽台外推；,RPVNMLSKKHKGFBA18DA,18.94,0.0,4.52,有,
士林區,土地,新安段六小段124地號,496.0,都市：其他:第一種住宅區(依都市計畫說明書圖規定辦理。本筆土地申請建築時，應依環境影響評估審查結論及臺北市山坡地開發建築要點規定，原自然地形平均坡度超過30%者，除水土保持必要設施外，不得作為建築使用，也不得計入建築基地面積檢討建蔽率及容積率，但可計入開發範圍。相關訊息請洽臺北市政府環境保護局綜合企劃小組或都市發展局規劃科。)。,,,1140207,土地1建物0車位0,,,其他,,,,0.0,0,0,0,無,無,40500000,81653,,0.0,0,親友、員工、共有人或其他特殊關係間之交易；,RPRNMLKLKHKGFEA47EA,0.0,0.0,0.0,無,005
士林區,房地(土地+建物),臺北市士林區葫蘆街３０巷３８號二樓,23.0,都市：其他:第三種住宅區。,,,1140208,土地1建物1車位0,二層,四層,公寓(5樓含以下無電梯),住家用,鋼筋混凝土造,0620207,72.94,4,1,1,有,無,4600000,63066,,0.0,0,親友、員工、共有人或其他特殊關係間之交易；,RPQNMLLLKHKGFEA47EA,72.94,0.0,0.0,無,
文山區,房地(土地+建物),臺北市文山區景福街５４巷１之１號,32.56,都市：其他:住宅區(專案國宅用地)。,,,1140211,土地1建物1車位0,一層,十四層,住宅大樓(11層含以上有電梯),商業用,鋼筋混凝土造,0880119,140.0,1,1,2,有,有,28000000,200000,,0.0,0,,RPVOMLLKKHKGFAA47DA,85.33,0.0,0.0,有,
中正區,房地(土地+建物)+車位,臺北市中正區金山南路一段５９號十四樓,32.81,住,,,1140205,土地4建物1車位2,十四層,十九層,住宅大樓(11層含以上有電梯),住家用,鋼骨造,1120606,338.82,0,0,0,無,有,147000000,516509,坡道平面,70.48,8400000,毛胚屋；,RPXNMLOKKHKGFBA97DA,152.96,8.54,10.19,有,
中正區,房地(土地+建物),臺北市中正區延平南路８３號十一樓之２,8.4,,,,1140217,土地1建物1車位0,十一層,十四層,住宅大樓(11層含以上有電梯),其他,鋼筋混凝土造,0900816,90.98,0,0,0,無,有,23500000,258299,,0.0,0,,RPSNMLSKKHKGFBA87DA,50.66,0.0,8.58,有,006
內湖區,車位,臺北市內湖區文湖街２１巷１１６號,0.4,都市：其他:第三種住宅區。,,,1140204,土地1建物1車位1,一層,十層,其他,商業用,鋼筋混凝土造,0970723,27.5,0,0,0,無,有,1750000,,坡道平面,34.59,1750000,僅車位交易；,RPSNMLPJKHKGFCA57DA,0.0,0.0,0.0,有,007
信義區,車位,臺北市信義區富陽街５７號地下一樓,0.05,都市：其他:第三種住宅區。,,,1140213,土地1建物1車位1,地下一層,七層,其他,一般事務所,鋼筋混凝土造,0991210,11.56,0,0,0,無,有,2100000,,升降機械,11.56,2100000,僅車位交易；,RPPOMLNKKHKGFDA37DA,0.0,0.0,0.0,有,008
北投區,房地(土地+建物),臺北市北投區裕民六路１３２號三樓,18.01,都市：其他:第三種商業區。,,,1140208,土地1建物1車位0,三層,十層,華廈(10層含以下有電梯),商業用,鋼筋混凝土造,0860225,136.79,2,2,1,有,有,32360000,236567,,0.0,0,陽台外推；其他增建；,RPXNMLMKKHKGFEA08DA,105.48,0.0,7.29,有,
北投區,車位,臺北市北投區民族街１５之１號,0.44,都市：其他:第三種住宅區。,,,1140210,土地1建物1車位1,一層,九層,其他,一般零售業（甲組）,鋼筋混凝土造,0961121,8.51,0,0,0,無,有,679000,,升降機械,7.93,679000,僅車位交易；,RPQNMLLLKHKGFEA37DA,0.0,0.0,0.0,有,009
大同區,房地(土地+建物),臺北市大同區民生西路２７０號五樓之１,23.55,都市：其他:第三種商業區。,,,1140208,土地1建物1車位0,五層,十三層,住宅大樓(11層含以上有電梯),商業用,鋼筋混凝土造,0891023,171.26999999999998,4,2,2,有,有,20000000,116775,,0.0,0,親友、員工、共有人或其他特殊關係間之交易；,RPUNMLLLKHKGFBA57EA,120.21,1.46,14.18,有,
內湖區,房地(土地+建物)+車位,臺北市內湖區星雲街１６８巷１１號,28.1,都市：其他:第三種住宅區。,,,1140203,土地1建物1車位1,一層，地下一層,十六層,住宅大樓(11層含以上有電梯),住家用,鋼筋混凝土造,0841116,189.14,5,2,3,有,有,33000000,174474,坡道平面,0.0,0,,RPQNMLLLKHKGFCA27EA,117.38,10.57,0.0,有,010
內湖區,車位,臺北市內湖區金湖路２３號門牌房屋地下三、四層,0.79,都市：其他:第三種住宅區。,,,1140209,土地1建物1車位1,地下一層，地下二層，地下三層，地下四層,十八層,其他,停車空間,鋼筋混凝土造,0840128,40.74,0,0,0,無,有,1830000,,坡道平面,40.75,1830000,親友、員工、共有人或其他特殊關係間之交易；僅車位交易；,RPOOMLKLKHKGFCA96DA,0.0,0.0,0.0,有,011
內湖區,車位,臺北市內湖區安康路４６２號等,0.33,都市：其他:第三種住宅區。,,,1140211,土地1建物1車位1,,,其他,,,,23.06,0,0,0,無,有,1550000,,坡道平面,23.05,1550000,僅車位交易；,RPRNMLLLKHKGFCA27DA,0.0,0.0,0.0,有,012
內湖區,車位,臺北市內湖區安康路４６２號等,0.23,都市：其他:第三種住宅區。,,,1140212,土地1建物1車位1,,,其他,,,,20.48,0,0,0,無,有,1250000,,坡道平面,20.47,1250000,僅車位交易；,RPSNMLLLKHKGFCA37DA,0.0,0.0,0.0,有,013
內湖區,車位,臺北市內湖區內湖路一段７０７號地下三層,1.6,都市：其他:第一種商業區。,,,1140215,土地1建物1車位1,地下三層,十四層,其他,停車空間,鋼筋混凝土造,1001028,34.94,0,0,0,無,有,2950000,,坡道平面,34.94,2950000,僅車位交易；,RPPNMLNLKHKGFCA27DA,0.0,0.0,0.0,有,014
松山區,房地(土地+建物)+車位,臺北市松山區復興北路８１巷２５號四樓之１,43.1,都市：其他:第參種商業區(依都市計畫說明書圖規定辦理，始得作第參種商業區使用)(原屬第貳種商業區)。,,,1140205,土地2建物1車位2,四層,十四層,住宅大樓(11層含以上有電梯),住家用,鋼骨鋼筋混凝土造,0990618,330.71,3,2,3,有,有,106500000,322034,坡道平面,68.66,0,,RPUOMLRJKHKGFDA18DA,150.19,13.18,16.54,有,
信義區,房地(土地+建物),臺北市信義區基隆路一段１７２巷３號,9.39,都市：其他:第四種住宅區。,,,1140212,土地1建物1車位0,一層,十三層,住宅大樓(11層含以上有電梯),商業用,鋼筋混凝土造,0781024,60.72,0,0,0,無,有,23881000,393297,,0.0,0,一衛生間,RPPNMLNKKHKGFDA27DA,39.81,6.89,0.0,有,
中山區,房地(土地+建物),臺北市中山區八德路二段２４５號四樓之４,7.54,商,,,1140206,土地2建物1車位0,四層,十二層,住宅大樓(11層含以上有電梯),商業用,鋼筋混凝土造,0670705,65.53999999999999,1,1,1,有,有,13881000,211794,,0.0,0,,RPPNMLOLKHKGFCA47EA,50.64,0.0,3.83,有,
松山區,房地(土地+建物),臺北市松山區市民大道五段３３之２號,2.98,都市：其他:第三之一種住宅區(特)。,,,1140208,土地1建物1車位0,一層，平台,四層,公寓(5樓含以下無電梯),住家用,鋼筋混凝土造,0640220,9.28,0,0,0,無,無,1350000,145474,,0.0,0,,RPQNMLOLKHKGFDA67EA,9.28,0.0,0.0,無,015
士林區,房地(土地+建物),臺北市士林區重慶北路四段２４４號,31.25,住,,,1140217,土地1建物1車位0,四層,四層,公寓(5樓含以下無電梯),住家用,加強磚造,0590605,94.36,2,1,1,有,無,13300000,140950,,0.0,0,親友、員工、共有人或其他特殊關係間之交易；,RPPNMLPLKHKGFEA77EA,94.36,0.0,0.0,無,016
文山區,車位,臺北市文山區萬寧街１２９號等房屋地下二層,0.0,,,,1140218,土地0建物1車位1,地下二層,十層,其他,見使用執照,鋼筋混凝土造,0811104,33.25,0,0,0,無,有,1800000,,坡道平面,0.0,1800000,建物坐落地號：萬芳段一小段4-2地號；僅車位交易；,RPRNMLKLKHKGFAA96DA,0.0,0.0,0.0,有,017
文山區,土地,景美段三小段84地號,2.0,都市：其他:第三種商業區(特),,,1140206,土地1建物0車位0,,,其他,,,,0.0,0,0,0,無,無,1000000,500000,,0.0,0,未登記建物；,RPPOMLOLKHKGFAA27DA,0.0,0.0,0.0,無,018
文山區,土地,景美段三小段86地號,29.5,都市：其他:第三種商業區(特),,,1140206,土地1建物0車位0,,,其他,,,,0.0,0,0,0,無,無,19800000,671186,,0.0,0,未登記建物；,SPPOMLOLKHKGFAA37DA,0.0,0.0,0.0,無,019
文山區,土地,博嘉段四小段4地號,7.54,都市：其他:第二種住宅區。,,,1140217,土地1建物0車位0,,,其他,,,,0.0,0,0,0,無,無,120000,15915,,0.0,0,親友、員工、共有人或其他特殊關係間之交易；,RPRNMLPLKHKGFAA47DA,0.0,0.0,0.0,無,
中正區,土地,永昌段一小段121-1地號,11.0,都市：其他:第三種住宅區。,,,1140219,土地2建物0車位0,,,其他,,,,0.0,0,0,0,無,無,1900000,172727,,0.0,0,,RPSNMLPLKHKGFAA57DA,0.0,0.0,0.0,無,
萬華區,房地(土地+建物)+車位,臺北市萬華區西寧南路３６號六樓之５０,12.86,都市：其他:第四種商業區。,,,1140208,土地1建物1車位1,六層,十層,華廈(10層含以下有電梯),商業用,預力混凝土造,0671215,114.89,3,1,2,有,有,18400000,195774,坡道平面,31.12,2000000,其他增建；,RPSNMLOKKHKGFBA47DA,71.03,0.0,0.0,有,
中正區,車位,臺北市中正區中華路一段９１巷６號等共有部分,0.08,都市：其他:第四種商業區。,,,1140212,土地1建物1車位1,,,其他,,,,30.25,0,0,0,無,有,2400000,,其他,30.25,2400000,僅車位交易；,RPSOMLSKKHKGFBA97DA,0.0,0.0,0.0,有,020
萬華區,土地,莒光段二小段390地號,32.5,都市：其他:第三種住宅區。,,,1140211,土地1建物0車位0,,,其他,,,,0.0,0,0,0,無,無,7085000,218000,,0.0,0,親友、員工、共有人或其他特殊關係間之交易；,RPRNMLPLKHKGFBA57DA,0.0,0.0,0.0,無,021
中山區,房地(土地+建物),臺北市中山區松江路５６２號五樓,13.12,都市：其他:第三之二種住宅區。,,,1140212,土地4建物1車位0,五層,六層,華廈(10層含以下有電梯),住家用,鋼筋混凝土造,0850719,67.07,2,1,1,有,有,13000000,193827,,0.0,0,親友、員工、共有人或其他特殊關係間之交易；,RPROMLPLKHKGFCA77DA,40.54,0.0,2.13,有,
內湖區,車位,臺北市內湖區港墘路１２７巷１０、１２號、港墘路１２７巷６弄７號、港墘路１２７巷１６弄２、４、６、８、１０號、江南街１２巷９、１１、１３、１５號門牌房屋地下二、三層,3.21,都市：其他:第三種住宅區。,,,1140210,土地1建物1車位1,地下二層，地下三層,十五層,其他,見使用執照,鋼筋混凝土造,0860806,44.26,0,0,0,無,有,2500000,,坡道平面,44.25,2500000,僅車位交易；,RPUNMLQLKHKGFCA08DA,0.0,0.0,0.0,有,022
信義區,車位,臺北市信義區光復南路５６７之１號,0.15,都市：其他:第參種商業區(依都市計畫說明書圖規定辦理，始得作第參種商業區使用)(原屬第貳種商業區)。,,,1140210,土地1建物1車位1,一層,十八層,其他,一般事務所,鋼骨造,0970822,23.84,0,0,0,無,有,3200000,,坡道平面,23.84,3200000,僅車位交易；,RPRNMLMKKHKGFDA37DA,0.0,0.0,0.0,有,023
信義區,房地(土地+建物),臺北市信義區永吉路１２０巷４３弄１之１號四樓,29.5,住,,,1140212,土地3建物1車位0,四層，陽臺,四層,公寓(5樓含以下無電梯),住家用,鋼筋混凝土造,0621231,86.52,3,2,1,有,無,22000000,254276,,0.0,0,頂樓加蓋；,RPQNMLNKKHKGFDA37DA,86.52,0.0,0.0,無,024
士林區,土地,溪洲段三小段150地號,73.83,都市：其他:公園用地(公共設施用地)(將來採區段徵收方式辦理整體開發)。82/1/5,,,1140210,土地7建物0車位0,,,其他,,,,0.0,0,0,0,無,無,5343450,72375,,0.0,0,,RPXNMLOLKHKGFEA38DA,0.0,0.0,0.0,無,025
士林區,車位,臺北市士林區德行東路２８３巷３３號,0.04,都市：其他:第三種住宅區。,,,1140215,土地1建物1車位1,一層,七層,其他,一般零售業,鋼筋混凝土造,0971222,5.6,0,0,0,無,有,720000,,塔式車位,5.6,720000,僅車位交易；,RPPQMLPLKHKGFEA97DA,0.0,0.0,0.0,無,026
中山區,土地,德惠段二小段171地號,7.49,都市：其他:道路用地(公共設施用地)。56/10/5,,,1140219,土地1建物0車位0,,,其他,,,,0.0,0,0,0,無,無,362840,48443,,0.0,0,包含公共設施保留地用地；,RPPNMLPLKHKGFCA57EA,0.0,0.0,0.0,無,027
文山區,房地(土地+建物)+車位,臺北市文山區辛亥路四段２０９巷３８號十九樓,16.31,住,,,1140101,土地1建物1車位1,十九層,二十六層,住宅大樓(11層含以上有電梯),住家用,鋼筋混凝土造,1090430,145.88,3,2,2,有,有,38000000,310922,坡道平面,32.99,2900000,,RPSNMLOJKHKGFAA27DA,65.48,5.55,6.53,有,028
文山區,土地,萬芳段四小段121地號,4.12,住,,,1140116,土地2建物0車位0,,,其他,,,,0.0,0,0,0,無,無,543840,132000,,0.0,0,親友、員工、共有人或其他特殊關係間之交易；未登記建物；,RPSNMLTKKHKGFAA87DA,0.0,0.0,0.0,無,
文山區,房地(土地+建物),臺北市文山區忠順街一段３５號,30.15,住,,,1140113,土地1建物1車位0,一層,六層,華廈(10層含以下有電梯),商業用,鋼筋混凝土造,0821123,104.16,2,2,1,有,有,21000000,201613,,0.0,0,,RPSNMLKLKHKGFAA07DA,86.89,6.35,0.0,有,
萬華區,房地(土地+建物),臺北市萬華區雙園街６０巷８０號,35.0,住,,,1140110,土地2建物1車位0,全,二層,透天厝,,加強磚造,,52.36,2,2,2,有,無,6143050,117323,,0.0,0,親友、員工、共有人或其他特殊關係間之交易；頂樓加蓋；,RPSNMLTKKHKGFBA97DA,52.36,0.0,0.0,無,
中山區,房地(土地+建物),臺北市中山區長安東路一段７５之１號四樓,10.01,商,,,1140106,土地1建物1車位0,四層,六層,華廈(10層含以下有電梯),住家用,鋼筋混凝土造,0620308,51.7,2,2,2,有,有,9700000,187621,,0.0,0,,RPWOMLLLJHKGFCA77DA,38.84,0.0,0.0,有,029
中山區,房地(土地+建物),臺北市中山區中山北路二段９３巷８號七樓之６,10.94,商,,,1140112,土地1建物1車位0,七層,十二層,住宅大樓(11層含以上有電梯),商業用,鋼筋混凝土造,0940803,78.8,4,2,2,有,有,27580000,350000,,0.0,0,夾層；其他增建；,RPQNMLKKKHKGFCA96DA,42.07,2.62,4.68,有,
中山區,房地(土地+建物),臺北市中山區林森北路６１２號四樓,23.11,商,,,1140104,土地1建物1車位0,四層,八層,華廈(10層含以下有電梯),,鋼筋混凝土造,0630628,187.23,1,1,1,有,有,33800000,180527,,0.0,0,,RPPNMLSKKHKGFCA67DA,187.23,0.0,0.0,有,
內湖區,房地(土地+建物)+車位,臺北市內湖區五分街９６號三樓,17.43,住,,,1140107,土地1建物1車位1,三層,十二層,住宅大樓(11層含以上有電梯),住家用,鋼筋混凝土造,1110113,124.56,2,2,1,有,有,27300000,266954,坡道平面,31.66,2500000,,RPSNMLSKKHKGFCA97DA,54.56,1.73,5.69,有,030
內湖區,房地(土地+建物)+車位,臺北市內湖區成功路四段３５８號五樓之１,31.91,商,,,1140117,土地4建物1車位1,五層,十九層,住宅大樓(11層含以上有電梯),住家用,鋼筋混凝土造,0860203,181.98,3,2,2,有,有,35000000,192329,坡道平面,40.5,0,,RPVNMLTKKHKGFCA38DA,97.08,1.3,13.73,有,
信義區,車位,臺北市信義區永吉路３７３號,0.09,商,,,1140123,土地1建物1車位1,一層,十四層,其他,一般事務所（Ｇ２）辦公室,鋼筋混凝土造,1060905,33.91,0,0,0,無,有,2800000,,坡道平面,33.91,2800000,僅車位交易；,RPVNMLMLJHKGFDA77DA,0.0,0.0,0.0,有,031
松山區,房地(土地+建物),臺北市松山區南京東路五段２３９號九樓之７,4.42,都市：其他:聯合開發區(捷)。,,,1140110,土地1建物1車位0,九層,十八層,住宅大樓(11層含以上有電梯),住家用,鋼筋混凝土造,0980331,55.5,1,1,1,有,有,17000000,306306,,0.0,0,,RPQNMLOJKHKGFDA37DA,31.52,1.39,3.65,有,032
南港區,車位,臺北市南港區東明街２８號地下三層,2.11,住,,,1140117,土地1建物1車位1,地下三層,十五層,其他,停車空間,鋼筋混凝土造,0980312,37.8,0,0,0,無,有,1680000,,坡道平面,37.8,1680000,僅車位交易；,RPQOMLMKKHKGFDA37DA,0.0,0.0,0.0,有,033
松山區,房地(土地+建物),臺北市松山區南京東路五段５９巷２７弄１２號二樓之１,20.39,住,,,1140119,土地1建物1車位0,二層,五層,華廈(10層含以下有電梯),住家用,鋼筋混凝土造,0830606,72.78,2,2,1,有,有,17500000,240451,,0.0,0,其他增建；,RPUTMLSKKHKGFDA88DA,50.02,0.0,6.99,有,
大安區,房地(土地+建物),臺北市大安區通化街３８巷２２號四樓之２,14.15,商,,,1140111,土地1建物1車位0,四層,七層,華廈(10層含以下有電梯),住家用,鋼筋混凝土造,0701229,90.14999999999999,2,2,2,有,有,22880000,253799,,0.0,0,陽台外推；其他增建；,RPQNMLPJKHKGFFA67DA,73.35,0.0,5.86,有,
北投區,房地(土地+建物)+車位,臺北市北投區中央北路一段１７５號三樓,7.69,商,,,1140109,土地2建物1車位1,三層,十層,華廈(10層含以下有電梯),商業用,鋼筋混凝土造,0860120,83.89,3,1,2,有,有,10500000,125164,升降平面,0.0,0,親友、員工、共有人或其他特殊關係間之交易；,RPWNMLTKKHKGFEA78EA,42.23,8.12,3.79,有,
士林區,土地,光華段二小段1002-1地號,30.0,都市：其他:道路用地(公共設施用地)。68/12/28,,,1140113,土地1建物0車位0,,,其他,,,,0.0,0,0,0,無,無,3465000,115500,,0.0,0,包含公共設施保留地用地；,RPXNMLTKKHKGFEA88EA,0.0,0.0,0.0,無,034
文山區,房地(土地+建物)+車位,臺北市文山區辛亥路四段２１巷２０號二樓之１,60.33,住,,,1140111,土地4建物1車位1,二層,十八層,住宅大樓(11層含以上有電梯),住家用,鋼筋混凝土造,0840801,166.32999999999998,3,2,2,有,有,24180000,145374,坡道平面,0.0,2000000,陽台外推；其他增建；,RPQNMLOJKHKGFAA07DA,90.97,3.51,9.32,有,
中正區,土地,河堤段二小段143地號,7.18,都市：其他:第參種商業區(依都市計畫說明書圖規定辦理，始得作第參種商業區使用)(原屬第貳種商業區)。,,,1140102,土地1建物0車位0,,,其他,,,,0.0,0,0,0,無,無,4826818,672259,,0.0,0,親友、員工、共有人或其他特殊關係間之交易；,RPPOMLSKKHKGFAA57DA,0.0,0.0,0.0,無,035
內湖區,車位,臺北市內湖區民權東路六段１５０之２號,0.0,都市：其他:第三種商業區。,,,1140114,土地1建物1車位1,一層,十四層,其他,商業用,鋼筋混凝土造,0980106,37.470000000000006,0,0,0,無,有,2330000,,坡道平面,37.47,2330000,僅車位交易；,RPSNMLQKKHKGFCA77DA,0.0,0.0,0.0,有,036
信義區,房地(土地+建物),臺北市信義區吳興街４５０巷１１弄９號三樓,25.1,住,,,1140103,土地1建物1車位0,三層,五層,公寓(5樓含以下無電梯),住家用,鋼筋混凝土造,0800909,93.42999999999999,3,2,2,有,無,18680000,199936,,0.0,0,其他增建；,RPPNMLSKJHKGFDA67DA,75.96,0.7,8.81,無,
松山區,房地(土地+建物),臺北市松山區復興北路１７９號七樓之３,3.87,商,,,1140105,土地5建物1車位0,七層,十二層,住宅大樓(11層含以上有電梯),住家用,鋼筋混凝土造,0660107,45.54,1,1,1,有,有,13200000,289855,,0.0,0,陽台外推；,RPSNMLTKKHKGFDA18DA,36.91,0.0,1.76,有,
士林區,房地(土地+建物)+車位,臺北市士林區社正路２６號六樓,20.61,商,,,1140110,土地1建物1車位3,六層,十三層,住宅大樓(11層含以上有電梯),住家用,鋼筋混凝土造,1090702,162.25,2,2,1,有,有,27800000,189686,其他,44.16,5400000,,RPVOMLNJKHKGFEA97DA,66.96,7.23,6.38,有,037
北投區,房地(土地+建物),臺北市北投區北投路一段７７號三樓之１,12.87,住,,,1140118,土地1建物1車位0,三層,十一層,住宅大樓(11層含以上有電梯),住家用,鋼筋混凝土造,0970331,89.3,3,1,2,有,有,23000000,257559,,0.0,0,陽台外推；,RPROMLOKKHKGFEA77DA,52.06,5.04,4.62,有,038
大安區,房地(土地+建物),臺北市大安區信義路二段８０號八樓之１,7.69,都市：其他:第參種商業區(依都市計畫說明書圖規定辦理，始得作第參種商業區使用)(原屬第貳種商業區)。,,,1140109,土地1建物1車位0,八層,十一層,住宅大樓(11層含以上有電梯),商業用,鋼筋混凝土造,0860317,72.49000000000001,2,2,1,有,有,32500000,448338,,0.0,0,夾層；其他增建；,RPUOMLOKJHKGFFA08DA,44.04,2.45,6.68,有,039
大同區,房地(土地+建物)+車位,臺北市大同區延平北路一段２９號二十八樓,18.09,都市：其他:第三種商業區。,,,1140116,土地1建物1車位1,二十八層,二十九層,住宅大樓(11層含以上有電梯),住家用,鋼骨ＲＣ造,1130418,290.46999999999997,3,2,2,有,有,72910000,272228,坡道平面,32.01,2550000,親友、員工、共有人或其他特殊關係間之交易；,RPPNMLKLKHKGFBA96EA,139.11,13.88,11.27,有,
萬華區,房地(土地+建物),臺北市萬華區雙園街４０巷８之１號,20.9,都市：其他:第三種住宅區。,,,1140114,土地1建物1車位0,一層,四層,公寓(5樓含以下無電梯),住家用,鋼筋混凝土造,0641120,80.57,3,2,1,有,無,21000000,260643,,0.0,0,其他增建；,RPQNMLKLKHKGFBA07EA,68.67,11.9,0.0,無,
萬華區,土地,莒光段四小段900地號,45.0,都市：其他:第三種住宅區。,,,1140114,土地1建物0車位0,,,其他,,,,0.0,0,0,0,無,無,3500000,77778,,0.0,0,未登記建物；,RPRNMLKLKHKGFBA17EA,0.0,0.0,0.0,無,
大安區,房地(土地+建物),臺北市大安區光復南路４３０號,8.24,都市：其他:第參種商業區(依都市計畫說明書圖規定辦理，始得作第參種商業區使用)(原屬第貳種商業區)。,,,1140110,土地1建物1車位0,一層，騎樓,十二層,住宅大樓(11層含以上有電梯),商業用,鋼筋混凝土造,0700130,96.47999999999999,0,0,1,有,有,58500000,606343,,0.0,0,其他增建；未登記建物；含租約；,RPQNMLKLKHKGFFA47EA,69.68,13.34,0.0,有,
中正區,房地(土地+建物),臺北市中正區羅斯福路一段１１９巷３之１號三樓,24.03,都市：其他:第參種商業區(依都市計畫說明書圖規定辦理，始得作第參種商業區使用)(原屬第貳種商業區)。,,,1140116,土地3建物1車位0,三層,四層,公寓(5樓含以下無電梯),,加強磚造,0570905,74.28,4,2,2,有,無,12760000,171782,,0.0,0,總價:1276萬土地拆分價款:1263萬建物拆分價款:13萬親友、員工、共有人或其他特殊關係間之交易；陽台外推；,RPVNMLKLKHKGFAA37DA,61.76,0.0,12.51,無,
萬華區,房地(土地+建物),臺北市萬華區昆明街１３６巷３號五樓,39.83,都市：其他:第四種商業區。,,,1140106,土地2建物2車位0,五層,五層,公寓(5樓含以下無電梯),,鋼筋混凝土造,0620517,172.74,0,0,0,無,無,22500000,130254,,0.0,0,391主建號及386主建號不拆價陽台外推；頂樓加蓋；,RPOPMLLLJHKGFBA96DA,172.74,0.0,0.0,無,
