鄉鎮市區,交易標的,土地位置建物門牌,土地移轉總面積平方公尺,都市土地使用分區,非都市土地使用分區,非都市土地使用編定,交易年月日,交易筆棟數,移轉層次,總樓層數,建物型態,主要用途,主要建材,建築完成年月,建物移轉總面積平方公尺,建物現況格局-房,建物現況格局-廳,建物現況格局-衛,建物現況格局-隔間,有無管理組織,總價元,單價元平方公尺,車位類別,車位移轉總面積平方公尺,車位總價元,備註,編號,主建物面積,附屬建物面積,陽台面積,電梯,移轉編號
The villages and towns urban district,transaction sign,land sector position building sector house number plate,land shifting total area square meter,the use zoning or compiles and checks,the non-metropolis land use district,non-metropolis land use,transaction year month and day,transaction pen number,shifting level,total floor number,building state,main use,main building materials,construction to complete the years,building shifting total area,Building present situation pattern - room,building present situation pattern - hall,building present situation pattern - health,building present situation pattern - compartmented,Whether there is manages the organization,total price NTD,the unit price (NTD / square meter),the berth category,berth shifting total area square meter,the berth total price NTD,the note,serial number,main building area,auxiliary building area,balcony area,elevator,transaction number
長濱鄉,土地,樟原段大峰峰小段236地號,5480.0,,風景區,農牧用地,1140210,土地1建物0車位0,,,其他,,,,0.0,0,0,0,無,無,8000000,1460,,0.0,0,未登記建物；,RPPNMLKKKHKGFBV88DA,0.0,0.0,0.0,無,
台東市,土地,康樂段1044地號,172.0,,特定農業區,農牧用地,1140217,土地1建物0車位0,,,其他,,,,0.0,0,0,0,無,無,130000,756,,0.0,0,,RPRNMLRKKHKGFAV07DA,0.0,0.0,0.0,無,
太麻里鄉,房地(土地+建物),臺東縣太麻里鄉龍泉路５３巷５號一樓之５３,17.32,商,,,1140211,土地2建物1車位0,一層,八層,華廈(10層含以下有電梯),其他,鋼筋混凝土造,0840714,61.52,1,1,1,有,有,1500000,24382,,0.0,0,,RPPNMLKLKHKGFDV56DA,45.42,4.78,0.0,有,01
台東市,房地(土地+建物),臺東縣台東市四川路二段３７２號,6390.77,,特定農業區,農牧用地,1140208,土地2建物1車位0,全,一層,透天厝,農業用,無墻有墻鋼架造,0880112,172.96,5,1,2,有,無,20000000,115634,,0.0,0,農作物；,RPPOMLKKKHKGFAV88DA,172.96,0.0,0.0,無,
綠島鄉,土地,下南寮段1194地號,153.34,都市：其他:保護區,,,1140212,土地2建物0車位0,,,其他,,,,0.0,0,0,0,無,無,1360000,8869,,0.0,0,農作物；,RPPNMLKLKHKGFAV88DA,0.0,0.0,0.0,無,02
太麻里鄉,房地(土地+建物),臺東縣太麻里鄉龍泉路５３巷５號七樓之９,15.01,商,,,1140212,土地2建物1車位0,七層,八層,華廈(10層含以下有電梯),其他,鋼筋混凝土造,0840714,37.81,1,1,1,有,有,700000,18514,,0.0,0,,RPTNMLMKKHKGFDV07DA,27.07,3.8,0.0,有,
太麻里鄉,房地(土地+建物),臺東縣太麻里鄉龍泉路５３巷５號七樓之７,15.01,商,,,1140212,土地2建物1車位0,七層,八層,華廈(10層含以下有電梯),其他,鋼筋混凝土造,0840714,37.81,1,1,1,有,有,700000,18514,,0.0,0,,RPUNMLMKKHKGFDV17DA,27.07,3.8,0.0,有,
太麻里鄉,房地(土地+建物),臺東縣太麻里鄉龍泉路５３巷３號五樓之２,8.08,商,,,1140215,土地2建物1車位0,五層,八層,華廈(10層含以下有電梯),其他,鋼筋混凝土造,0830930,36.99,0,0,0,無,有,1200000,32441,,0.0,0,,RPPNMLRKKHKGFDV17DA,27.74,0.0,3.8,有,
台東市,房地(土地+建物),臺東縣台東市傳廣路５２８號四樓之１,5.35,住,,,1140214,土地2建物1車位0,四層,七層,華廈(10層含以下有電梯),住家用,鋼筋混凝土造,0830126,32.18,1,0,1,有,有,1630000,50653,,0.0,0,,RPPNMLOLKHKGFAV66DA,21.82,0.0,2.01,有,
台東市,房地(土地+建物),臺東縣台東市康樂路１３１巷７弄８號三樓,23.41,都市：其他:住宅區,,,1140207,土地4建物1車位0,三層,五層,公寓(5樓含以下無電梯),住家用,鋼筋混凝土造,0840601,92.19,3,2,2,有,無,4600000,49897,,0.0,0,含傢俱設備費；,RPQNMLOLKHKGFAV76DA,63.7,10.26,0.0,無,
太麻里鄉,房地(土地+建物),臺東縣太麻里鄉龍泉路５３巷３號四樓之３７,8.08,商,,,1140217,土地2建物1車位0,四層,八層,華廈(10層含以下有電梯),其他,鋼筋混凝土造,0830930,36.99,0,0,0,無,有,1100000,29738,,0.0,0,,RPQNMLRKKHKGFDV27DA,27.74,0.0,3.8,有,
台東市,土地,大豐段6地號,3038.7,,特定農業區,農牧用地,1140103,土地1建物0車位0,,,其他,,,,0.0,0,0,0,無,無,4500000,1481,,0.0,0,含小型水井一口、農用電表一個。農作物；機電設備；,RPPNMLQKJHKGFAV66DA,0.0,0.0,0.0,無,03
台東市,土地,豐里段108地號,1429.72,,特定農業區,農牧用地,1140126,土地2建物0車位0,,,其他,,,,0.0,0,0,0,無,無,1000000,699,,0.0,0,,RPSNMLQJKHKGFAV96DA,0.0,0.0,0.0,無,
台東市,房地(土地+建物),臺東縣台東市廣東路３４７號,40.9,住,,,1140126,土地2建物1車位0,全,一層,透天厝,住家用,木造,,25.34,0,0,0,無,無,800000,31571,,0.0,0,,RPQNMLSKKHKGFAV07DA,18.73,6.61,0.0,無,
台東市,房地(土地+建物)+車位,臺東縣台東市柳州街２７３號,17.27,商,,,1140107,土地1建物1車位1,一層,十四層,住宅大樓(11層含以上有電梯),商業用,ＲＣ造,1110328,109.62,0,1,1,有,有,11000000,100347,坡道平面,28.7,0,,RPUNMLSKKHKGFAV47DA,60.43,0.0,0.0,有,04
卑南鄉,土地,太平段246地號,1221.73,,特定農業區,農牧用地,1140122,土地2建物0車位0,,,其他,,,,0.0,0,0,0,無,無,5260000,4305,,0.0,0,親友、員工、共有人或其他特殊關係間之交易；未登記建物；農作物；,RPSNMLKLKHKGFAV56DA,0.0,0.0,0.0,無,
成功鎮,房地(土地+建物),臺東縣成功鎮豐田路２７之１號,182.25,,風景區,丙種建築用地,1140122,土地1建物1車位0,全,二層,透天厝,住家用,加強磚造,0760316,105.56,3,3,4,有,無,5000000,47366,,0.0,0,,RPPNMLLLKHKGFBV09DA,101.64,3.92,0.0,無,
綠島鄉,土地,下南寮段1175地號,271.13,都市：其他:保護區,,,1140118,土地1建物0車位0,,,其他,,,,0.0,0,0,0,無,無,2400000,8852,,0.0,0,農作物；,RPQNMLLLKHKGFAV09DA,0.0,0.0,0.0,無,
長濱鄉,房地(土地+建物),臺東縣長濱鄉長濱１５５號,130.71,住,,,1140113,土地2建物1車位0,全,二層,透天厝,住家用,加強磚造,0800212,141.69,3,2,1,有,無,3200000,22585,,0.0,0,,RPRNMLRKJHKGFBV07DA,137.44,0.0,4.25,無,
成功鎮,土地,玉港段569地號,4124.5,,風景區,農牧用地,1140117,土地1建物0車位0,,,其他,,,,0.0,0,0,0,無,無,6081835,1475,,0.0,0,,RPQNMLNKKHKGFBV66DA,0.0,0.0,0.0,無,
大武鄉,土地,復興段418-3地號,242.53,住,,,1131227,土地2建物0車位0,,,其他,,,,0.0,0,0,0,無,無,3511000,14477,,0.0,0,政府機關標讓售；,RPQNMLMKKHKGFDV76DA,0.0,0.0,0.0,無,
台東市,土地,豐成段189地號,842.85,,特定農業區,農牧用地,1131227,土地1建物0車位0,,,其他,,,,0.0,0,0,0,無,無,2549612,3025,,0.0,0,,RPPNMLPKKHKGFAV66DA,0.0,0.0,0.0,無,05
台東市,建物,臺東縣台東市大同路１４１號一樓之１１號,0.0,,,,1131230,土地0建物1車位0,一層,九層,華廈(10層含以下有電梯),商業用,鋼筋混凝土造,0831124,33.71,0,0,0,無,無,100000,2966,,0.0,0,建物坐落地號：台東段434-1地號；,RPQNMLPJJHKGFAV56DA,15.42,0.0,0.0,有,
台東市,土地,豐成段189地號,674.28,,特定農業區,農牧用地,1131228,土地1建物0車位0,,,其他,,,,0.0,0,0,0,無,無,2039688,3025,,0.0,0,,RPQNMLPKKHKGFAV76DA,0.0,0.0,0.0,無,05
成功鎮,房地(土地+建物),臺東縣成功鎮開封街１２０號,149.13,住,,,1131207,土地1建物1車位0,全,三層,透天厝,住家用,鋼筋混凝土造,1130815,221.65,3,2,4,有,無,12000000,54139,,0.0,0,,RPQNMLLLKHKGFBV56DA,205.85,0.0,15.8,無,
台東市,房地(土地+建物),臺東縣台東市志航二街６１號,105.28,住,,,1131230,土地1建物1車位0,全,三層,透天厝,住家用,鋼筋混凝土造,1130821,198.66,4,2,5,有,無,15500000,78023,,0.0,0,土地成交價860萬元整，建物成交價690萬元整,RPQNMLKLKHKGFAV98DA,186.76,11.9,0.0,無,
成功鎮,土地,玉港段569-2地號,1610.44,,風景區,農牧用地,1131214,土地3建物0車位0,,,其他,,,,0.0,0,0,0,無,無,2374554,1474,,0.0,0,,RPRNMLNKKHKGFBV76DA,0.0,0.0,0.0,無,07
台東市,房地(土地+建物),臺東縣台東市中興路四段６１１巷４６號,217.98,商,,,1131119,土地3建物1車位0,全,三層,透天厝,住家用,鋼筋混凝土造,1130717,264.73,5,2,6,有,無,15500000,58550,,0.0,0,含傢俱設備費；包含公共設施保留地用地；,RPXNMLPLKIJGFAV57DA,243.71,21.02,0.0,無,
台東市,房地(土地+建物),臺東縣台東市吉林路一段６號,104.54,,風景區,丙種建築用地,1131122,土地1建物1車位0,全,三層,透天厝,住商用,鋼筋混凝土造,0840104,149.35,5,2,3,有,無,6300000,42183,,0.0,0,其他增建；,RPQNMLOJKHKGFAV56DA,134.61,0.0,14.74,無,
台東市,房地(土地+建物),臺東縣台東市上海街１４巷３１弄１號,61.0,都市：其他:住宅區,,,1131112,土地1建物1車位0,全,二層,透天厝,住家用,加強磚造,0671204,75.6,2,2,2,有,無,6800000,89947,,0.0,0,,RPPNMLTKKHKGFAV07DA,75.6,0.0,0.0,無,08
台東市,土地,富岡段801地號,132.08,,鄉村區,乙種建築用地,1131127,土地1建物0車位0,,,其他,,,,0.0,0,0,0,無,無,900000,6814,,0.0,0,親友、員工、共有人或其他特殊關係間之交易；未登記建物；,RPRNMLKLKHKGFAV09DA,0.0,0.0,0.0,無,
台東市,房地(土地+建物),臺東縣台東市豐盛路２６巷５９之３號,210.29,商,,,1131108,土地1建物1車位0,全,二層,透天厝,住家用,ＲＣ造,0990122,249.36,4,2,4,有,無,17880000,71704,,0.0,0,,RPSNMLPKJIJGFAV86DA,215.75,33.61,0.0,無,09
台東市,房地(土地+建物),臺東縣台東市更生北路２１７巷８號五樓之二,30.23,商,,,1131028,土地1建物1車位0,五層,五層,華廈(10層含以下有電梯),住家用,鋼筋混凝土造,1130528,103.77,3,2,2,有,無,7800000,75166,,0.0,0,親友、員工、共有人或其他特殊關係間之交易；,RPRNMLOKJHKGFAV66DA,75.0,5.6,0.0,有,
台東市,房地(土地+建物),臺東縣台東市興盛路３１３巷１６弄１８號三樓之二,41.35,住,,,1120801,土地1建物1車位0,三層,五層,華廈(10層含以下有電梯),住家用,鋼筋混凝土造,1131220,125.81,3,2,2,有,有,7800000,61998,,0.0,0,土地及建物分別計價：土地款為新台幣1809000元整、建物款為新台幣5991000元整、預售屋、或土地及建物分件登記案件；,RPSNMLNKKHKGFAV76DA,84.11,9.97,0.0,有,
台東市,房地(土地+建物),臺東縣台東市興盛路３１３巷１６弄１８號四樓之二,41.35,住,,,1120801,土地1建物1車位0,四層,五層,華廈(10層含以下有電梯),住家用,鋼筋混凝土造,1131220,125.81,3,2,2,有,有,8000000,63588,,0.0,0,土地及建物分別計價：土地款為新台幣1809000元整、建物款為新台幣6191000元整、預售屋、或土地及建物分件登記案件；,RPUNMLNKKHKGFAV96DA,84.11,9.97,0.0,有,
台東市,房地(土地+建物)+車位,臺東縣台東市興盛路３１３巷１６弄１８號五樓之一,48.12,住,,,1120822,土地1建物1車位1,五層,五層,華廈(10層含以下有電梯),住家用,鋼筋混凝土造,1131220,160.28,3,2,2,有,有,9990000,64421,一樓平面,14.52,600000,土地及建物及車位分別計價：土地款為新台幣2106000元整、建物款為新台幣7284000元整、車位款為新台幣600000元整預售屋、或土地及建物分件登記案件；,RPVNMLNKKHKGFAV07DA,96.4,12.46,0.0,有,
台東市,房地(土地+建物)+車位,臺東縣台東市興盛路３１３巷１６弄１８號五樓之二,41.35,住,,,1120821,土地1建物1車位1,五層,五層,華廈(10層含以下有電梯),住家用,鋼筋混凝土造,1131220,139.16,3,2,2,有,有,8880000,65416,一樓平面,13.35,650000,土地及建物及車位分別計價：土地款為新台幣1809000元整、建物款為新台幣6421000元整、車位款為新台幣650000元整預售屋、或土地及建物分件登記案件；,RPWNMLNKKHKGFAV17DA,84.11,9.97,0.0,有,
台東市,房地(土地+建物)+車位,臺東縣台東市興盛路３１３巷１６弄１８號二樓之一,49.2,住,,,1120712,土地1建物1車位1,二層,五層,華廈(10層含以下有電梯),住家用,鋼筋混凝土造,1131220,163.14,3,2,2,有,有,9760000,61634,一樓平面,14.52,600000,土地及建物及車位分別計價：土地款為新台幣2153000元整、建物款為新台幣7007000元整、車位款為新台幣600000元整預售屋、或土地及建物分件登記案件；,RPQNMLNKKHKGFAV56DA,96.4,14.51,0.0,有,
台東市,房地(土地+建物)+車位,臺東縣台東市興盛路３１３巷１６弄１８號三樓之一,47.77,都市：其他:住宅區,,,1120712,土地1建物1車位1,三層,五層,華廈(10層含以下有電梯),住家用,鋼筋混凝土造,1131220,159.23000000000002,3,2,2,有,有,9710000,62953,一樓平面,14.52,600000,土地及建物及車位分別計價：土地款為新台幣2090000元整、建物款為新台幣7020000元整、車位款為新台幣600000元整預售屋、或土地及建物分件登記案件；,RPRNMLNKKHKGFAV66DA,96.4,11.66,0.0,有,
台東市,房地(土地+建物)+車位,臺東縣台東市興盛路３１３巷１６弄１８號四樓之一,48.12,住,,,1120712,土地1建物1車位1,四層,五層,華廈(10層含以下有電梯),住家用,鋼筋混凝土造,1131220,167.89,3,2,2,有,有,10080000,63666,一樓平面,22.13,800000,土地及建物及車位分別計價：土地款為新台幣2106000元整、建物款為新台幣7174000元整、車位款為新台幣800000元整預售屋、或土地及建物分件登記案件；,RPTNMLNKKHKGFAV86DA,96.4,12.46,0.0,有,
台東市,房地(土地+建物),臺東縣台東市興盛路３１３巷１６弄１８號二樓之二,41.35,住,,,1120714,土地1建物1車位0,二層,五層,華廈(10層含以下有電梯),住家用,鋼筋混凝土造,1131220,125.81,3,2,2,有,有,7350000,58421,,0.0,0,土地及建物分別計價：土地款為新台幣1089000元整、建物款為新台幣6261000元整、預售屋、或土地及建物分件登記案件；,RPRNMLSKKHKGFAV17DA,84.11,9.97,0.0,有,
台東市,土地,南王段41地號,1435.96,,,,1110504,土地4建物0車位0,,,其他,,,,0.0,0,0,0,無,無,6100000,4248,,0.0,0,依照土地法34-1條辦理之買賣過戶,RPRNMLOJKIJGFAV66DA,0.0,0.0,0.0,無,
